{
  "pcfra_id": "guest-1908",
  "version": "1.0",
  "person_ref": "guest:booking-55421",
  "building_ref": "building:hotel-quay",
  "assessed_at": "2025-08-19T16:00:00Z",
  "assessor_role": "front_desk",
  "assessment_method": "digital_self",
  "confidence_level": "medium",
  "consent_ref": "consent:guest-55421",
  "capability": {
    "walking_endurance": "normal_pace",
    "respiratory_tolerance": "normal",
    "mobility_transfer": "independent_transfer",
    "stair_tolerance": "stairs_independent",
    "mobility_aid": "none",
    "communication_support": "plain_language",
    "night_response": "wakes_to_alarm",
    "behavioural_risks": []
  },
  "outcome": {
    "relevant_resident": false,
    "peep_required": false,
    "rationale": "Short-stay guest; no identified needs beyond standard EES/guest instructions."
  }
}